<?xml version="1.0" encoding="UTF-8"?>
<!ELEMENT books (book+)>

<!ELEMENT book    (name,publisher,company,author,ISBN,price,url,relevance*)>

<!ELEMENT name      (#PCDATA)>
<!ELEMENT publisher    (#PCDATA)>
<!ELEMENT company 	(#PCDATA)>
<!ELEMENT author    (#PCDATA)>
<!ELEMENT ISBN    (#PCDATA)>
<!ELEMENT price    (#PCDATA)>
<!ELEMENT url    (#PCDATA)>
<!ELEMENT relevance    (#PCDATA)>

<!ATTLIST book UID ID #REQUIRED>
<!ATTLIST relevance relUID IDREF #REQUIRED>
